{
  "format": "luciole-graph",
  "format_version": 1,
  "root": "examples",
  "generator": { "name": "luciole", "version": "0.1.0" },
  "nodes": [
    { "id": "shop", "kind": "module", "name": "shop", "parent": null, "file": "shop.py",
      "loc": { "line": 1, "col": 0, "end_line": 31, "end_col": 10 } },

    { "id": "shop#TAX_RATE", "kind": "variable", "name": "TAX_RATE", "parent": "shop", "file": "shop.py",
      "loc": { "line": 3, "col": 0, "end_line": 3, "end_col": 8 }, "role": "global" },

    { "id": "shop:with_tax", "kind": "function", "name": "with_tax", "parent": "shop", "file": "shop.py",
      "loc": { "line": 6, "col": 0, "end_line": 8, "end_col": 26 }, "body_line": 7 },
    { "id": "shop:with_tax#amount", "kind": "variable", "name": "amount", "parent": "shop:with_tax", "file": "shop.py",
      "loc": { "line": 6, "col": 13, "end_line": 6, "end_col": 19 }, "role": "param", "param_index": 0 },
    { "id": "shop:with_tax#total", "kind": "variable", "name": "total", "parent": "shop:with_tax", "file": "shop.py",
      "loc": { "line": 7, "col": 4, "end_line": 7, "end_col": 9 }, "role": "local" },
    { "id": "shop:with_tax#return", "kind": "variable", "name": "return", "parent": "shop:with_tax", "file": "shop.py",
      "loc": { "line": 8, "col": 4, "end_line": 8, "end_col": 26 }, "role": "return" },

    { "id": "shop:Cart", "kind": "class", "name": "Cart", "parent": "shop", "file": "shop.py",
      "loc": { "line": 11, "col": 0, "end_line": 19, "end_col": 38 }, "bases": [] },
    { "id": "shop:Cart#subtotal", "kind": "variable", "name": "subtotal", "parent": "shop:Cart", "file": "shop.py",
      "loc": { "line": 13, "col": 8, "end_line": 13, "end_col": 21 }, "role": "instance_attr" },

    { "id": "shop:Cart.__init__", "kind": "function", "name": "__init__", "parent": "shop:Cart", "file": "shop.py",
      "loc": { "line": 12, "col": 4, "end_line": 13, "end_col": 25 }, "body_line": 13 },
    { "id": "shop:Cart.__init__#self", "kind": "variable", "name": "self", "parent": "shop:Cart.__init__", "file": "shop.py",
      "loc": { "line": 12, "col": 17, "end_line": 12, "end_col": 21 }, "role": "param", "param_index": 0 },

    { "id": "shop:Cart.add", "kind": "function", "name": "add", "parent": "shop:Cart", "file": "shop.py",
      "loc": { "line": 15, "col": 4, "end_line": 16, "end_col": 30 }, "body_line": 16 },
    { "id": "shop:Cart.add#self", "kind": "variable", "name": "self", "parent": "shop:Cart.add", "file": "shop.py",
      "loc": { "line": 15, "col": 12, "end_line": 15, "end_col": 16 }, "role": "param", "param_index": 0 },
    { "id": "shop:Cart.add#price", "kind": "variable", "name": "price", "parent": "shop:Cart.add", "file": "shop.py",
      "loc": { "line": 15, "col": 18, "end_line": 15, "end_col": 23 }, "role": "param", "param_index": 1 },

    { "id": "shop:Cart.total", "kind": "function", "name": "total", "parent": "shop:Cart", "file": "shop.py",
      "loc": { "line": 18, "col": 4, "end_line": 19, "end_col": 38 }, "body_line": 19 },
    { "id": "shop:Cart.total#self", "kind": "variable", "name": "self", "parent": "shop:Cart.total", "file": "shop.py",
      "loc": { "line": 18, "col": 14, "end_line": 18, "end_col": 18 }, "role": "param", "param_index": 0 },
    { "id": "shop:Cart.total#return", "kind": "variable", "name": "return", "parent": "shop:Cart.total", "file": "shop.py",
      "loc": { "line": 19, "col": 8, "end_line": 19, "end_col": 38 }, "role": "return" },

    { "id": "shop:main", "kind": "function", "name": "main", "parent": "shop", "file": "shop.py",
      "loc": { "line": 22, "col": 0, "end_line": 27, "end_col": 26 }, "body_line": 23 },
    { "id": "shop:main#cart", "kind": "variable", "name": "cart", "parent": "shop:main", "file": "shop.py",
      "loc": { "line": 23, "col": 4, "end_line": 23, "end_col": 8 }, "role": "local" },
    { "id": "shop:main#due", "kind": "variable", "name": "due", "parent": "shop:main", "file": "shop.py",
      "loc": { "line": 26, "col": 4, "end_line": 26, "end_col": 7 }, "role": "local" }
  ],
  "edges": [
    { "kind": "calls", "source": "shop", "target": "shop:main",
      "sites": [{ "line": 31, "col": 4 }] },
    { "kind": "calls", "source": "shop:Cart.total", "target": "shop:with_tax",
      "sites": [{ "line": 19, "col": 15 }] },
    { "kind": "calls", "source": "shop:main", "target": "shop:Cart.__init__",
      "sites": [{ "line": 23, "col": 11 }] },
    { "kind": "calls", "source": "shop:main", "target": "shop:Cart.add",
      "sites": [{ "line": 24, "col": 4 }, { "line": 25, "col": 4 }] },
    { "kind": "calls", "source": "shop:main", "target": "shop:Cart.total",
      "sites": [{ "line": 26, "col": 10 }] },

    { "kind": "writes", "source": "shop", "target": "shop#TAX_RATE",
      "sites": [{ "line": 3, "col": 0 }] },
    { "kind": "reads", "source": "shop#TAX_RATE", "target": "shop:with_tax",
      "sites": [{ "line": 7, "col": 26 }] },
    { "kind": "reads", "source": "shop:with_tax#amount", "target": "shop:with_tax",
      "sites": [{ "line": 7, "col": 12 }] },
    { "kind": "writes", "source": "shop:with_tax", "target": "shop:with_tax#total",
      "sites": [{ "line": 7, "col": 4 }] },
    { "kind": "reads", "source": "shop:with_tax#total", "target": "shop:with_tax",
      "sites": [{ "line": 8, "col": 17 }] },
    { "kind": "writes", "source": "shop:with_tax", "target": "shop:with_tax#return",
      "sites": [{ "line": 8, "col": 4 }] },
    { "kind": "writes", "source": "shop:Cart.__init__", "target": "shop:Cart#subtotal",
      "sites": [{ "line": 13, "col": 8 }] },
    { "kind": "reads", "source": "shop:Cart#subtotal", "target": "shop:Cart.add",
      "sites": [{ "line": 16, "col": 8 }] },
    { "kind": "reads", "source": "shop:Cart.add#price", "target": "shop:Cart.add",
      "sites": [{ "line": 16, "col": 25 }] },
    { "kind": "writes", "source": "shop:Cart.add", "target": "shop:Cart#subtotal",
      "sites": [{ "line": 16, "col": 8 }] },
    { "kind": "reads", "source": "shop:Cart#subtotal", "target": "shop:Cart.total",
      "sites": [{ "line": 19, "col": 24 }] },
    { "kind": "writes", "source": "shop:Cart.total", "target": "shop:Cart.total#return",
      "sites": [{ "line": 19, "col": 8 }] },
    { "kind": "writes", "source": "shop:main", "target": "shop:main#cart",
      "sites": [{ "line": 23, "col": 4 }] },
    { "kind": "reads", "source": "shop:main#cart", "target": "shop:main",
      "sites": [{ "line": 24, "col": 4 }, { "line": 25, "col": 4 }, { "line": 26, "col": 10 }] },
    { "kind": "writes", "source": "shop:main", "target": "shop:main#due",
      "sites": [{ "line": 26, "col": 4 }] },
    { "kind": "reads", "source": "shop:main#due", "target": "shop:main",
      "sites": [{ "line": 27, "col": 20 }] },

    { "kind": "flows_to", "source": "shop:with_tax#amount", "target": "shop:with_tax#total",
      "sites": [{ "line": 7, "col": 4 }] },
    { "kind": "flows_to", "source": "shop#TAX_RATE", "target": "shop:with_tax#total",
      "sites": [{ "line": 7, "col": 4 }] },
    { "kind": "flows_to", "source": "shop:with_tax#total", "target": "shop:with_tax#return",
      "sites": [{ "line": 8, "col": 4 }] },
    { "kind": "flows_to", "source": "shop:Cart.add#price", "target": "shop:Cart#subtotal",
      "sites": [{ "line": 16, "col": 8 }] },

    { "kind": "passes_arg", "source": "shop:Cart#subtotal", "target": "shop:with_tax#amount",
      "sites": [{ "line": 19, "col": 24 }] },
    { "kind": "passes_arg", "source": "shop:main#cart", "target": "shop:Cart.add#self",
      "sites": [{ "line": 24, "col": 4 }, { "line": 25, "col": 4 }] },
    { "kind": "passes_arg", "source": "shop:main#cart", "target": "shop:Cart.total#self",
      "sites": [{ "line": 26, "col": 10 }] },

    { "kind": "returns", "source": "shop:with_tax#return", "target": "shop:Cart.total#return",
      "sites": [{ "line": 19, "col": 15 }] },
    { "kind": "returns", "source": "shop:Cart.total#return", "target": "shop:main#due",
      "sites": [{ "line": 26, "col": 10 }] }
  ]
}
